{
  "causal_operator": {
    "Higgs_Yukawa_order": 0,
    "advanced_Green_map": "E_t^+",
    "causal_support": true,
    "globally_hyperbolic_base": true,
    "neutral_frame": "D_Y tensor I96+Gamma_Y tensor h D_phys(t)",
    "operator": "D_dir(t;A,H)=D_A+Y_t(H)",
    "principal_symbol": "sigma_Ddir(x,xi)=i Clifford_g(xi) tensor I96",
    "principal_symbol_unchanged": true,
    "retarded_Green_map": "E_t^-",
    "test_domain": "C_c^infinity(Y4,S_Y tensor E_F)",
    "varying_background_scope": "lower-order connection and Higgs derivative terms retained"
  },
  "check_summary": {
    "failed": [],
    "passed": 67,
    "total": 67
  },
  "checks": {
    "T14_provider_neutral_interface_is_exact": true,
    "T20_finite_source_is_exact": true,
    "T23_physical_Dirac_source_is_exact": true,
    "T24_graded_totalization_is_exact": true,
    "advanced_retarded_Green_maps_are_available": true,
    "classical_BV_master_equation_closes": true,
    "classical_fermion_Yukawa_action_is_BRST_closed": true,
    "continuum_SM_carrier_and_BV_source_pass": true,
    "continuum_response_is_h_squared_H_phys": true,
    "contract_schema_is_exact": true,
    "direct_product_dimension_is_192": true,
    "direct_realization_truth_value_advances": true,
    "direct_source_root_contains_no_observed_target": true,
    "direct_source_root_inserts_no_HYM_endpoint": true,
    "direct_source_root_selects_no_numerical_h_or_t": true,
    "direct_square_is_exact_graded_sum": true,
    "eta9_is_not_a_source_dependency": true,
    "external_grading_anticommutes_with_Dirac": true,
    "external_spacetime_is_not_retyped_as_finite": true,
    "family_Yukawa_matrices_are_gauge_neutral": true,
    "fermion_Yukawa_BRST_is_nilpotent": true,
    "fiber_analysis_synthesis_are_identity": true,
    "fiber_complement_is_zero": true,
    "fiber_projector_is_identity": true,
    "finite_exactness_precedent_is_scoped": true,
    "finite_real_even_source_is_96_dimensional": true,
    "full_provider_neutral_source_remains_open": true,
    "handoff_is_pinned": true,
    "internal_complement_rank_is_zero": true,
    "internal_feshbach_term_is_zero": true,
    "internal_omitted_mode_tail_is_empty": true,
    "kernel_model_is_pinned": true,
    "neutral_finite_square_is_identity": true,
    "no_observed_or_fitted_input": true,
    "nonlinear_action_and_QME_remain_open": true,
    "physical_response_digest_matches_T23": true,
    "physical_response_norm_matches_T23": true,
    "physical_response_rank_matches_T23": true,
    "provider_neutral_direct_operator_clause_advances": true,
    "q79_HYM_endpoint_remains_open": true,
    "q79_physical_packet_acceptance_is_unchanged": true,
    "q79_physical_row_acceptance_is_unchanged": true,
    "quantum_BV_is_not_promoted": true,
    "selected_base_has_Dirac_principal_symbol": true,
    "signed_action_is_not_positive_repair_square": true,
    "source_01_hash_matches": true,
    "source_02_hash_matches": true,
    "source_03_hash_matches": true,
    "source_04_hash_matches": true,
    "source_05_hash_matches": true,
    "source_06_hash_matches": true,
    "source_07_hash_matches": true,
    "source_08_hash_matches": true,
    "source_09_hash_matches": true,
    "source_10_hash_matches": true,
    "source_11_hash_matches": true,
    "source_12_hash_matches": true,
    "source_13_hash_matches": true,
    "source_14_hash_matches": true,
    "source_15_hash_matches": true,
    "source_16_hash_matches": true,
    "source_17_hash_matches": true,
    "source_18_hash_matches": true,
    "source_lock_schema_is_exact": true,
    "strict_top_level_contract": true,
    "strict_values_remain_open": true,
    "zero_order_Higgs_preserves_principal_symbol": true
  },
  "claim_id": "CBF.T25",
  "classical_action_and_bv": {
    "BRST_nilpotent": true,
    "classical_BV_master_equation": "(S_BV,S_BV)=0",
    "classical_action_BRST_closed": true,
    "family_matrices_commute_with_gauge_action": true,
    "fermion_Yukawa_classical_sublane_closed": true,
    "four_Yukawa_channels_are_gauge_singlets": true,
    "objects_identified": false,
    "positive_repair_diagnostic": "E_rep=1/2 ||D_dir psi||^2",
    "quantum_master_equation_closed": false,
    "renormalized_interacting_net_closed": false,
    "signed_fermion_action": "S_ferm=integral_Y4 <bar(psi),D_dir psi> dvol_g"
  },
  "contract_schema_sha256": "d135e25891a695a868db23327397c965d3acc2abcfb779cb38ad8cbd125c3483",
  "date": "2026-08-29",
  "direct_internal_realization": {
    "analysis_synthesis": "U_x^* U_x=I96",
    "associated_bundle": "E_F=P_SM times_(rho_F) H_F",
    "complement": "Q_int=0",
    "complement_rank": 0,
    "external_spacetime_is_finite_cutoff": false,
    "feshbach_complement_term": "0",
    "fiber_dimension": 96,
    "finite_source": "(A_F,H_F,D_phys(t),Gamma_F,J_F)",
    "internal_truncation_error": "0",
    "local_analysis": "U_x^*",
    "local_synthesis": "U_x",
    "omitted_internal_modes": 0,
    "projector": "P_int=I_(E_F)",
    "projector_rank": 96,
    "synthesis_analysis": "U_x U_x^*=I_(E_F,x)",
    "transition_rule": "U_t(x)=U_s(x) rho_F(g_st(x))"
  },
  "direct_source_root_sha256": "624ae0d4cce64f99d24b014b7c8341b56e298b87c07dbc6660262a94b745c6a7",
  "exact_response": {
    "H_phys_frobenius_norm_squared": "768",
    "H_phys_rank": 96,
    "H_phys_sha256": "2b78943ded404370d6c2f4216aab01b71c1bc06f4056a6a44a6ee407ad3d398f",
    "factorized_square": "D_dir(t,h)^2=D_Y^2 tensor I96+h^2 I tensor D_phys(t)^2",
    "finite_neutral_square": "D_phys(0)^2=I96",
    "first_variation": "d_t D_dir(t,h)^2|0=h^2 I tensor H_phys",
    "internal_Galerkin_error": "0",
    "internal_interpolation_error": "0",
    "internal_quadrature_error": "0",
    "operator_dimension_witness": 192,
    "scalar_Higgs_potential_Hessian_claimed": false
  },
  "frontier_delta": "The A48-A51/CBF.T23 96-dimensional finite real-even datum now has an exact associated-bundle realization over the selected four-dimensional globally hyperbolic carrier. Fiberwise synthesis is the identity, so the internal complement, Feshbach correction, omitted-mode tail and truncation error vanish exactly. The graded continuum Dirac-Yukawa square reproduces h^2 H_phys and inherits gauge covariance, Green hyperbolicity and the classical BV master equation. This closes the direct structural route, not the distinct q79 HYM provenance route or numerical value selection; q79 acceptance therefore remains 0/3 packets and 0/7 rows.",
  "parameter_ledger": {
    "inherited_universal_dimensionful_primitives": 1,
    "new_fitted_coefficients": 0,
    "new_internal_Galerkin_coefficients": 0,
    "new_internal_cutoff_scales": 0,
    "new_observed_construction_inputs": 0,
    "new_sector_specific_physical_scales": 0,
    "numerical_h_selected": false,
    "numerical_t_selected": false
  },
  "physical_boundary": {
    "B_ACTION_01_closed": false,
    "B_GEO_01_closed_as_written": false,
    "bosonic_gravitational_direct_source_complete": false,
    "direct_finite_source_continuum_realized": true,
    "full_nonlinear_upper_action_selected": false,
    "full_provider_neutral_source_closed": false,
    "held_out_scalar_prediction": false,
    "physical_q79_HYM_endpoint_selected": false,
    "provider_neutral_direct_operator_clause": true,
    "q79_HYM_synthesis_closed": false,
    "quantum_BV_QME_closed": false,
    "strict_numerical_values_selected": false
  },
  "physical_packets_accepted": 0,
  "physical_packets_total": 3,
  "physical_rows_accepted": 0,
  "physical_rows_total": 7,
  "route_classification": {
    "HYM_Galerkin_map_required_for_HYM_provenance": true,
    "HYM_Galerkin_map_required_for_direct_route": false,
    "HYM_route": "open",
    "direct_route": "closed at exact structural causal realization tier",
    "direct_route_internal_synthesis": "fiberwise identity",
    "future_comparison_target": "universality/intertwining theorem",
    "routes_identified": false
  },
  "schema": "boe.mtt.direct-finite-source-continuum.v1",
  "source_lock_sha256": "2375458907d1ca046bd9d2f8d8cad799fe67a271f1850ce2467faf7554f48e88",
  "source_provenance": {
    "all_source_hashes_match": true,
    "direct_source_root_payload": {
      "continuum_HYM_endpoint": null,
      "continuum_operator": "D_dir(t;A,H)=D_A+Y_t(H); in a covariantly constant neutral frame D_Y tensor I96+Gamma_Y tensor h D_phys(t)",
      "internal_source": {
        "analysis": "U_x^*",
        "complement": "Q_int=0",
        "fiber_dimension": 96,
        "kind": "exact finite real-even associated-bundle fiber",
        "projector": "P_int=U_x U_x^*=I96",
        "synthesis": "U_x"
      },
      "numerical_higgs_vacuum": null,
      "numerical_source_coordinate": null,
      "observed_targets": [],
      "repository_heads": {
        "mtt-causal-base-constraint-fiber": "780fc621864341d528b5fb116c652fcb581f0a2a",
        "mtt-q79-total-superconnection-branching": "251e6d82b09ffbf3c35630a9b5c979f6bf080706",
        "mtt-qm-source-proof": "cd3c13b665d6712dd78655cf0d2007231f634065",
        "mtt-sm-parity-closure": "774bd880893043d5bcede64ae49020303e3d5d66"
      },
      "response_sha256": "2b78943ded404370d6c2f4216aab01b71c1bc06f4056a6a44a6ee407ad3d398f",
      "schema": "boe.mtt.direct-finite-source-root.v1",
      "source_hashes": [
        "0f4e684b6b175423e1a253023c2dbd1b6828a595fa0186feba9495b0ac66e94f",
        "b051b722cbee420e17a965499f943a166b231cb9dee4233dc0542e2f0f957ab7",
        "06faef972ba717fc1b0952b8b86c5e37e1e277af7ddd22141ac9500e8754cf41",
        "bcebda1f01ce9fb66f56758a2cb5705063bd644dbfb49f069f38add323486e88",
        "841f6acae3fec4331695d2b706f914dfb991c251f96f493b79ab5bd74b3fb01a",
        "11c47dfa3cb0bceb44160b720abc178ff39e64ceec378931feaa59af47bd9e42",
        "d07d66ce1e67398472692c50fa81bceab696d55df5a9728a691e4b791bc9bc32",
        "9cffb9e688968f4debe4f5f10a618788155d9df663ae900843e663aff3b8f7f5",
        "44a342958ec30e015894e1fe807e1fee40b366cc12f46791417e6ef5c54e103a",